{
  "contract": {
    "name": "hyperpolymath/proven-tests/evidence",
    "revision": "1.0.0",
    "major": 1
  },
  "subject": {
    "repo": "hyperpolymath/ordering-demo",
    "commit": "1111111111111111111111111111111111111111",
    "producer": {
      "tool": "proven-tests collect-evidence",
      "version": "1.0.0"
    }
  },
  "toolchain": {
    "runner": "ubuntu-24.04",
    "rust": "1.85.0",
    "idris2": null
  },
  "taxonomy": {
    "revision": "proven-tests/taxonomy/1",
    "cells": 238
  },
  "tests": [
    {
      "id": "ordering::is_total",
      "kind": "example",
      "coord": {
        "category": "UnitTest",
        "aspect": "Functionality"
      },
      "result": "passed",
      "execution": {
        "ran": true,
        "command": [
          "cargo",
          "test",
          "--test",
          "ordering",
          "--",
          "--test-threads=1"
        ],
        "runner": "ubuntu-24.04",
        "started_at": "2026-10-25T10:00:00Z",
        "finished_at": "2026-10-25T10:00:02Z",
        "duration_ms": 2000,
        "exit_code": 0,
        "observed_output_digest": "sha256:aaaaaaaaaaaaaaaaaaaaaaaaaaaaaaaaaaaaaaaaaaaaaaaaaaaaaaaaaaaaaaaa"
      },
      "claim": "unproven",
      "evidence": {},
      "fixtures": {
        "silence": {
          "path": "tests/fixtures/empty.txt",
          "description": "an empty slice: no pair is ever out of order"
        },
        "firing": {
          "path": "tests/fixtures/inverted.txt",
          "defect_class": "a pair whose comparator reports both a<b and b<a"
        }
      },
      "anchor": {
        "log": "test.log",
        "line": 3
      }
    },
    {
      "id": "property::min_is_commutative",
      "kind": "property",
      "coord": {
        "category": "PropertyBasedTest",
        "aspect": "Dependability"
      },
      "result": "passed",
      "execution": {
        "ran": true,
        "command": [
          "cargo",
          "test",
          "--test",
          "ordering",
          "--",
          "--test-threads=1"
        ],
        "runner": "ubuntu-24.04",
        "started_at": "2026-10-25T10:00:00Z",
        "finished_at": "2026-10-25T10:00:02Z",
        "duration_ms": 2000,
        "exit_code": 0,
        "observed_output_digest": "sha256:aaaaaaaaaaaaaaaaaaaaaaaaaaaaaaaaaaaaaaaaaaaaaaaaaaaaaaaaaaaaaaaa"
      },
      "claim": "provisionally_proven",
      "evidence": {
        "property": {
          "generator": "arb_ext_nat_pair",
          "shrinker": true,
          "cases_run": 256,
          "failures": 0,
          "seed": "0x5eed"
        },
        "type_safety": {
          "kategoria_level": 6,
          "type_system": "Idris2",
          "verified_by": "ProvenTests.Types.TypeSafetyCertificate"
        },
        "framework_safety": "ProvenTests.Cells.provenTestsFrameworkProof"
      },
      "fixtures": {
        "silence": {
          "path": "tests/fixtures/empty.txt",
          "description": "an empty slice: no pair is ever out of order"
        },
        "firing": {
          "path": "tests/fixtures/inverted.txt",
          "defect_class": "a pair whose comparator reports both a<b and b<a"
        }
      },
      "anchor": {
        "log": "test.log",
        "line": 9
      }
    },
    {
      "id": "proof::oplus_commutative",
      "kind": "proof",
      "coord": {
        "category": "ProofRegressionTest",
        "aspect": "Dependability"
      },
      "result": "passed",
      "execution": {
        "ran": true,
        "command": [
          "idris2",
          "--check",
          "src/ProvenTests/Tropical.idr"
        ],
        "runner": "ubuntu-24.04",
        "started_at": "2026-10-25T10:00:00Z",
        "finished_at": "2026-10-25T10:00:07Z",
        "duration_ms": 7000,
        "exit_code": 0,
        "observed_output_digest": "sha256:bbbbbbbbbbbbbbbbbbbbbbbbbbbbbbbbbbbbbbbbbbbbbbbbbbbbbbbbbbbbbbbb"
      },
      "claim": "actually_proven",
      "evidence": {
        "type_safety": {
          "kategoria_level": 6,
          "type_system": "Idris2",
          "verified_by": "ProvenTests.Types.TypeSafetyCertificate"
        },
        "proof": {
          "checked": true,
          "checker": {
            "name": "idris2",
            "version": "0.7.0"
          },
          "design_proof": {
            "technique": "total, machine-checked Idris2 proof",
            "limitations": []
          },
          "theorems": [
            {
              "name": "oplusComm",
              "statement": "(a, b : ExtNat) -> oplus a b = oplus b a",
              "term_digest": "sha256:aaaaaaaaaaaaaaaaaaaaaaaaaaaaaaaaaaaaaaaaaaaaaaaaaaaaaaaaaaaaaaaa",
              "file": "src/ProvenTests/Tropical.idr",
              "line": 41
            }
          ]
        }
      },
      "fixtures": {
        "cannot_fail_by_design": "the property is enforced by the typechecker; no runtime firing fixture can exist"
      },
      "anchor": {
        "log": "check.log",
        "line": 1
      }
    }
  ],
  "counts": {
    "records": 3,
    "executed": 3,
    "passed": 3,
    "failed": 0,
    "error": 0,
    "skipped": 0,
    "not_run": 0,
    "excluded_debt": 0
  }
}
